{
  "schema": "motion-edit/v1",
  "baseHash": "f6e8720f69d50ac0d32d7f4e37051df5c82f2e4deec25d350c1457c7e86343f1",
  "resultHash": "62c643d6ea611515d9d0e92620a246db4b5abca302207764dd5b105c899bba02",
  "ops": [
    {
      "op": "replace",
      "path": "/notes/2",
      "value": "End with: Try it free for 30 days"
    }
  ],
  "affectedScenes": [],
  "summary": "notes #3: \"End with: Start free at ledgerly.example\" → \"End with: Try it free for 30 days\""
}
