{
  "schema": "motion-edit/v1",
  "baseHash": "5f36021ec43e57f50daf5715f771177ae601d098f6991f40582f5cc1781ddd13",
  "resultHash": "93b27e5889018c0aba6f03a6e31e804f72fa6841aae1115266ea092059d09520",
  "ops": [
    {
      "op": "replace",
      "path": "/scenes/1/idea",
      "value": "Two bars side by side: 12% turnover with flexible hours vs 21% with fixed hours; highlight the gap"
    }
  ],
  "affectedScenes": [
    "s2"
  ],
  "summary": "Scene s2 › idea: \"Bar chart: flexible teams 12% turnover vs fixed hours 21%...\" → \"Two bars side by side: 12% turnover with flexible hours v...\""
}
