{
  "schema": "motion-edit/v1",
  "baseHash": "37f5857ed8c7383fb50ae4fccce8c8637fe3c11574f5898e4287e52220c48135",
  "resultHash": "070906e0b13417ba19053a0bf23f42453b4247ca47ed80d64f23c1ffa809e77a",
  "ops": [
    {
      "op": "add",
      "path": "/notes/-",
      "value": "Mention that the template is free on GitHub"
    }
  ],
  "affectedScenes": [],
  "summary": "notes (new item): added \"Mention that the template is free on GitHub\""
}
