{
  "schema": "motion-edit/v1",
  "baseHash": "0ec66d2af0a67dc858c978e451a02a66cc04b30150a89a7b39f382e3b0a73a5d",
  "resultHash": "e739b95bb7184f12268e6811f6eaf9788f3138f8ad5f612a09d6391b6e54a6d6",
  "ops": [
    {
      "op": "replace",
      "path": "/scenes/2/voText",
      "value": "One thousand dollars at seven percent nearly doubles in ten years, and grows more than seven times in thirty."
    }
  ],
  "affectedScenes": [
    "s3"
  ],
  "summary": "Scene s3 › voText: \"Put one thousand dollars away at seven percent. In ten ye...\" → \"One thousand dollars at seven percent nearly doubles in t...\""
}
